[
  {
    "dataset_id": "AE_NMC",
    "cell_id": "AE_NMC_reference_unknown_serial",
    "protocol_id": "C20_discharge",
    "segment_id": "C/20 discharge",
    "time_s": 0,
    "current_raw_A": -0.625,
    "current_discharge_A": 0.625,
    "voltage_V": 4.19367569,
    "reference_temperature_K": 298.15,
    "surface_temperature_K": null,
    "core_temperature_K": null,
    "data_kind": "source_embedded_reference_curve",
    "source_id": "S01"
  },
  {
    "dataset_id": "AE_NMC",
    "cell_id": "AE_NMC_reference_unknown_serial",
    "protocol_id": "C20_discharge",
    "segment_id": "C/20 discharge",
    "time_s": 1000,
    "current_raw_A": -0.625,
    "current_discharge_A": 0.625,
    "voltage_V": 4.1677888,
    "reference_temperature_K": 298.15,
    "surface_temperature_K": null,
    "core_temperature_K": null,
    "data_kind": "source_embedded_reference_curve",
    "source_id": "S01"
  },
  {
    "dataset_id": "AE_NMC",
    "cell_id": "AE_NMC_reference_unknown_serial",
    "protocol_id": "C20_discharge",
    "segment_id": "C/20 discharge",
    "time_s": 2000,
    "current_raw_A": -0.625,
    "current_discharge_A": 0.625,
    "voltage_V": 4.14976386,
    "reference_temperature_K": 298.15,
    "surface_temperature_K": null,
    "core_temperature_K": null,
    "data_kind": "source_embedded_reference_curve",
    "source_id": "S01"
  },
  {
    "dataset_id": "AE_NMC",
    "cell_id": "AE_NMC_reference_unknown_serial",
    "protocol_id": "C20_discharge",
    "segment_id": "C/20 discharge",
    "time_s": 3000,
    "current_raw_A": -0.625,
    "current_discharge_A": 0.625,
    "voltage_V": 4.13250593,
    "reference_temperature_K": 298.15,
    "surface_temperature_K": null,
    "core_temperature_K": null,
    "data_kind": "source_embedded_reference_curve",
    "source_id": "S01"
  },
  {
    "dataset_id": "AE_NMC",
    "cell_id": "AE_NMC_reference_unknown_serial",
    "protocol_id": "C20_discharge",
    "segment_id": "C/20 discharge",
    "time_s": 4000,
    "current_raw_A": -0.625,
    "current_discharge_A": 0.625,
    "voltage_V": 4.11582327,
    "reference_temperature_K": 298.15,
    "surface_temperature_K": null,
    "core_temperature_K": null,
    "data_kind": "source_embedded_reference_curve",
    "source_id": "S01"
  },
  {
    "dataset_id": "AE_NMC",
    "cell_id": "AE_NMC_reference_unknown_serial",
    "protocol_id": "C20_discharge",
    "segment_id": "C/20 discharge",
    "time_s": 5000,
    "current_raw_A": -0.625,
    "current_discharge_A": 0.625,
    "voltage_V": 4.09952412,
    "reference_temperature_K": 298.15,
    "surface_temperature_K": null,
    "core_temperature_K": null,
    "data_kind": "source_embedded_reference_curve",
    "source_id": "S01"
  },
  {
    "dataset_id": "AE_NMC",
    "cell_id": "AE_NMC_reference_unknown_serial",
    "protocol_id": "C20_discharge",
    "segment_id": "C/20 discharge",
    "time_s": 6000,
    "current_raw_A": -0.625,
    "current_discharge_A": 0.625,
    "voltage_V": 4.08360848,
    "reference_temperature_K": 298.15,
    "surface_temperature_K": null,
    "core_temperature_K": null,
    "data_kind": "source_embedded_reference_curve",
    "source_id": "S01"
  },
  {
    "dataset_id": "AE_NMC",
    "cell_id": "AE_NMC_reference_unknown_serial",
    "protocol_id": "C20_discharge",
    "segment_id": "C/20 discharge",
    "time_s": 7000,
    "current_raw_A": -0.625,
    "current_discharge_A": 0.625,
    "voltage_V": 4.06788459,
    "reference_temperature_K": 298.15,
    "surface_temperature_K": null,
    "core_temperature_K": null,
    "data_kind": "source_embedded_reference_curve",
    "source_id": "S01"
  },
  {
    "dataset_id": "AE_NMC",
    "cell_id": "AE_NMC_reference_unknown_serial",
    "protocol_id": "C20_discharge",
    "segment_id": "C/20 discharge",
    "time_s": 8000,
    "current_raw_A": -0.625,
    "current_discharge_A": 0.625,
    "voltage_V": 4.05254422,
    "reference_temperature_K": 298.15,
    "surface_temperature_K": null,
    "core_temperature_K": null,
    "data_kind": "source_embedded_reference_curve",
    "source_id": "S01"
  },
  {
    "dataset_id": "AE_NMC",
    "cell_id": "AE_NMC_reference_unknown_serial",
    "protocol_id": "C20_discharge",
    "segment_id": "C/20 discharge",
    "time_s": 9000,
    "current_raw_A": -0.625,
    "current_discharge_A": 0.625,
    "voltage_V": 4.03720384,
    "reference_temperature_K": 298.15,
    "surface_temperature_K": null,
    "core_temperature_K": null,
    "data_kind": "source_embedded_reference_curve",
    "source_id": "S01"
  },
  {
    "dataset_id": "AE_NMC",
    "cell_id": "AE_NMC_reference_unknown_serial",
    "protocol_id": "C20_discharge",
    "segment_id": "C/20 discharge",
    "time_s": 10000,
    "current_raw_A": -0.625,
    "current_discharge_A": 0.625,
    "voltage_V": 4.02186346,
    "reference_temperature_K": 298.15,
    "surface_temperature_K": null,
    "core_temperature_K": null,
    "data_kind": "source_embedded_reference_curve",
    "source_id": "S01"
  },
  {
    "dataset_id": "AE_NMC",
    "cell_id": "AE_NMC_reference_unknown_serial",
    "protocol_id": "C20_discharge",
    "segment_id": "C/20 discharge",
    "time_s": 11000,
    "current_raw_A": -0.625,
    "current_discharge_A": 0.625,
    "voltage_V": 4.00690659,
    "reference_temperature_K": 298.15,
    "surface_temperature_K": null,
    "core_temperature_K": null,
    "data_kind": "source_embedded_reference_curve",
    "source_id": "S01"
  },
  {
    "dataset_id": "AE_NMC",
    "cell_id": "AE_NMC_reference_unknown_serial",
    "protocol_id": "C20_discharge",
    "segment_id": "C/20 discharge",
    "time_s": 12000,
    "current_raw_A": -0.625,
    "current_discharge_A": 0.625,
    "voltage_V": 3.99194973,
    "reference_temperature_K": 298.15,
    "surface_temperature_K": null,
    "core_temperature_K": null,
    "data_kind": "source_embedded_reference_curve",
    "source_id": "S01"
  },
  {
    "dataset_id": "AE_NMC",
    "cell_id": "AE_NMC_reference_unknown_serial",
    "protocol_id": "C20_discharge",
    "segment_id": "C/20 discharge",
    "time_s": 13000,
    "current_raw_A": -0.625,
    "current_discharge_A": 0.625,
    "voltage_V": 3.97699286,
    "reference_temperature_K": 298.15,
    "surface_temperature_K": null,
    "core_temperature_K": null,
    "data_kind": "source_embedded_reference_curve",
    "source_id": "S01"
  },
  {
    "dataset_id": "AE_NMC",
    "cell_id": "AE_NMC_reference_unknown_serial",
    "protocol_id": "C20_discharge",
    "segment_id": "C/20 discharge",
    "time_s": 14000,
    "current_raw_A": -0.625,
    "current_discharge_A": 0.625,
    "voltage_V": 3.96222774,
    "reference_temperature_K": 298.15,
    "surface_temperature_K": null,
    "core_temperature_K": null,
    "data_kind": "source_embedded_reference_curve",
    "source_id": "S01"
  },
  {
    "dataset_id": "AE_NMC",
    "cell_id": "AE_NMC_reference_unknown_serial",
    "protocol_id": "C20_discharge",
    "segment_id": "C/20 discharge",
    "time_s": 15000,
    "current_raw_A": -0.625,
    "current_discharge_A": 0.625,
    "voltage_V": 3.94727088,
    "reference_temperature_K": 298.15,
    "surface_temperature_K": null,
    "core_temperature_K": null,
    "data_kind": "source_embedded_reference_curve",
    "source_id": "S01"
  },
  {
    "dataset_id": "AE_NMC",
    "cell_id": "AE_NMC_reference_unknown_serial",
    "protocol_id": "C20_discharge",
    "segment_id": "C/20 discharge",
    "time_s": 16000,
    "current_raw_A": -0.625,
    "current_discharge_A": 0.625,
    "voltage_V": 3.93250576,
    "reference_temperature_K": 298.15,
    "surface_temperature_K": null,
    "core_temperature_K": null,
    "data_kind": "source_embedded_reference_curve",
    "source_id": "S01"
  },
  {
    "dataset_id": "AE_NMC",
    "cell_id": "AE_NMC_reference_unknown_serial",
    "protocol_id": "C20_discharge",
    "segment_id": "C/20 discharge",
    "time_s": 17000,
    "current_raw_A": -0.625,
    "current_discharge_A": 0.625,
    "voltage_V": 3.9173572,
    "reference_temperature_K": 298.15,
    "surface_temperature_K": null,
    "core_temperature_K": null,
    "data_kind": "source_embedded_reference_curve",
    "source_id": "S01"
  },
  {
    "dataset_id": "AE_NMC",
    "cell_id": "AE_NMC_reference_unknown_serial",
    "protocol_id": "C20_discharge",
    "segment_id": "C/20 discharge",
    "time_s": 18000,
    "current_raw_A": -0.625,
    "current_discharge_A": 0.625,
    "voltage_V": 3.90240027,
    "reference_temperature_K": 298.15,
    "surface_temperature_K": null,
    "core_temperature_K": null,
    "data_kind": "source_embedded_reference_curve",
    "source_id": "S01"
  },
  {
    "dataset_id": "AE_NMC",
    "cell_id": "AE_NMC_reference_unknown_serial",
    "protocol_id": "C20_discharge",
    "segment_id": "C/20 discharge",
    "time_s": 19000,
    "current_raw_A": -0.625,
    "current_discharge_A": 0.625,
    "voltage_V": 3.8874434,
    "reference_temperature_K": 298.15,
    "surface_temperature_K": null,
    "core_temperature_K": null,
    "data_kind": "source_embedded_reference_curve",
    "source_id": "S01"
  },
  {
    "dataset_id": "AE_NMC",
    "cell_id": "AE_NMC_reference_unknown_serial",
    "protocol_id": "C20_discharge",
    "segment_id": "C/20 discharge",
    "time_s": 20000,
    "current_raw_A": -0.625,
    "current_discharge_A": 0.625,
    "voltage_V": 3.87191127,
    "reference_temperature_K": 298.15,
    "surface_temperature_K": null,
    "core_temperature_K": null,
    "data_kind": "source_embedded_reference_curve",
    "source_id": "S01"
  },
  {
    "dataset_id": "AE_NMC",
    "cell_id": "AE_NMC_reference_unknown_serial",
    "protocol_id": "C20_discharge",
    "segment_id": "C/20 discharge",
    "time_s": 21000,
    "current_raw_A": -0.625,
    "current_discharge_A": 0.625,
    "voltage_V": 3.85637914,
    "reference_temperature_K": 298.15,
    "surface_temperature_K": null,
    "core_temperature_K": null,
    "data_kind": "source_embedded_reference_curve",
    "source_id": "S01"
  },
  {
    "dataset_id": "AE_NMC",